{
  "$schema": "https://json-schema.org/draft/2020-12/schema",
  "title": "aoa-local-text-contract-fit summary-with-breakdown report",
  "type": "object",
  "additionalProperties": false,
  "required": [
    "eval_name",
    "bundle_status",
    "object_under_evaluation",
    "verdict",
    "claim_boundary",
    "limitations",
    "case_family",
    "per_case_breakdown"
  ],
  "properties": {
    "eval_name": {
      "const": "aoa-local-text-contract-fit"
    },
    "bundle_status": {
      "const": "portable"
    },
    "object_under_evaluation": {
      "const": "local text lane contract-fit on compact control and structure prompts"
    },
    "verdict": {
      "type": "string",
      "enum": [
        "supports bounded claim",
        "mixed support",
        "does not support bounded claim"
      ]
    },
    "claim_boundary": {
      "type": "string",
      "minLength": 20
    },
    "limitations": {
      "type": "array",
      "minItems": 1,
      "items": {
        "type": "string",
        "minLength": 3
      }
    },
    "case_family": {
      "type": "string",
      "minLength": 5
    },
    "per_case_breakdown": {
      "type": "array",
      "minItems": 1,
      "items": {
        "type": "object",
        "additionalProperties": false,
        "required": [
          "case_id",
          "contract_surface",
          "expected_shape",
          "observed_shape",
          "latency_note",
          "failure_vs_readout",
          "outcome"
        ],
        "properties": {
          "case_id": {
            "type": "string",
            "minLength": 3
          },
          "contract_surface": {
            "type": "string",
            "minLength": 3
          },
          "expected_shape": {
            "type": "string",
            "minLength": 10
          },
          "observed_shape": {
            "type": "string",
            "minLength": 10
          },
          "latency_note": {
            "type": "string",
            "minLength": 10
          },
          "failure_vs_readout": {
            "type": "string",
            "minLength": 10
          },
          "outcome": {
            "type": "string",
            "enum": [
              "approve",
              "defer"
            ]
          }
        }
      }
    }
  }
}
